ID,Designation,Object classes,Description,Category,Field type,Unit group,Index,R/O,API define
13001,Plot frame to edit form,Form,The plot frame that is used for editing the form.,Settings,Monolingual text,Not defined,No,No,FORM_FRAME
13002,Form handling,Form,"Defines the form as being static or dynamic: 0 = static, 1 = dynamic.",Settings,Boolean (True / False),Not defined,No,No,FORM_BEHAVIOUR_STATIC_DYN
13003,Regenerate header after change,Form,"In this form property, you define the properties that cause a new data header area to be generated on the report page when they change.",Settings,Monolingual text,Not defined,No,No,FORM_RECREATE_MAINTITLE
13004,No. of columns,Form,Maximum number of columns to be generated on a page.,Settings,Integer,Not defined,No,No,FORM_COL_SIZE
13005,No. of rows,Form,Maximum number of rows to be generated on a page.,Settings,Integer,Not defined,No,No,FORM_ROW_SIZE
13006,Column width,Form,Width of the individual columns on a form.,Settings,Coordinates (only X or Y),Not defined,No,No,FORM_COL_WIDTH
13007,Row height,Form,Height of the individual rows on a form.,Settings,Coordinates (only X or Y),Not defined,No,No,FORM_ROW_HEIGHT
13008,Form orientation,Form,"Sequence in which rows and columns are to be filled out: 0 = By row or 1 = By column. ""By row"" means that all the cells of a row are populated first before switching to the next row. In this case, jumpers are displayed vertically. ""By column"" means that all cells of a column are populated first before switching to the next column. In this case, jumpers are displayed horizontally.",Settings,Integer,Not defined,No,No,FORM_BEHAVIOUR_ROW_COL
13009,Dynamic line adjustment,Form,"If indirect properties are indexed with 0, then the values for all (meaningful) indices are printed together. This is generally done using one-row lists separated by semicolons. In forms, however, you can output these values as separate elements (rows/columns).",Settings,Boolean (True / False),Not defined,No,No,FORM_DYN_ROW_ALIGN
13010,Jumpers: Height of first level,Form,Height of a first level jumper in the terminal diagram.,Settings,Coordinates (only X or Y),Not defined,No,No,FORM_JUMPER_FIRST_LEV_HEIGHT
13011,Connections,Form,"Used in forms for representing the terminal diagram. The assignment of a connection to two connection points is thus shown as a three-tuple (an ordered quantity of assignments); multiple connection assignments are each separated by a ""pipe"" character.",Settings,Monolingual text,Not defined,No,No,FORM_CABLE_ASSIGNMENT_CONNECTED_TERMINALS
13012,Jumpers: Spacing,Form,Clearance between two jumpers at neighboring levels.,Settings,Coordinates (only X or Y),Not defined,No,No,FORM_JUMPER_DISTANCE
13013,Jumpers: Radius for nodes,Form,"If jumpers are shown graphically in terminal diagrams, a small filled circle is set on the base line on each leg of the jumper. The radius of this circle is specified with this property (in software coordinates).",Settings,Coordinates (only X or Y),Not defined,No,No,FORM_JUMPER_CP_RADIUS
13014,Jumpers: Radius of connecting points,Form,"Nodes of jumpers are graphically shown in the terminal diagram with a small filled circle. The radius of this circle is specified with this property (in software coordinates). (Start and end ""legs"" do not have dots.)",Settings,Coordinates (only X or Y),Not defined,No,No,FORM_JUMPER_NODE_RADIUS
13015,Jumpers: Height of internal wire jumper / insertable jumper,Form,"Height of an internal wire jumper or insertable jumper of the first level in the terminal diagram. If the property is not set, the ""Jumpers: Height of first level"" property is used instead.",Settings,Coordinates (only X or Y),Not defined,No,No,FORM_JUMPER_WIRE_JUMPER_INT_HEIGHT
13016,Jumpers: Height of external wire jumper/ insertable jumper,Form,"Height of an external wire jumper or insertable jumper of the first level in the terminal diagram. If the property is not set, the ""Jumpers: Height of first level"" property is used instead.",Settings,Coordinates (only X or Y),Not defined,No,No,FORM_JUMPER_WIRE_JUMPER_EXT_HEIGHT
13017,Jumpers: Spacing of internal wire jumper/ insertable jumper,Form,"Clearance between two internal wire jumpers or insertable jumpers at neighboring levels. If the property is not set, the ""Jumpers: Height of first level"" property is used instead.",Settings,Coordinates (only X or Y),Not defined,No,No,FORM_JUMPER_WIRE_JUMPER_INT_DISTANCE
13018,Jumpers: Spacing of external wire jumper/ insertable jumper,Form,"Clearance between two external wire jumpers or insertable jumpers at neighboring levels. If the property is not set, the ""Jumpers: Height of first level"" property is used instead.",Settings,Coordinates (only X or Y),Not defined,No,No,FORM_JUMPER_WIRE_JUMPER_EXT_DISTANCE
13019,Format for automatic page description,Form,Format for automatically assigned page descriptions in the generation of reporting lists.,Settings,Monolingual text,Not defined,No,No,FORM_PAGE_DESC_AUTOFORMAT
13020,Assignment: Index to graphic,Form,"A fixed graphic can be inserted in connection diagrams or other forms using the ""Graphic"" placeholder. The configuration property exists for the placeholder to allow the graphic to be exchanged with any other graphic. Here you assign an index value to the graphic. The graphic is then selected in the ""Graphic"" placeholder by specifying the index value.",Settings,Monolingual text,Not defined,No,No,FORM_RELATION_INDEX_GRAPHIC
13021,Assignment: Function definition to graphic,Form,Assignment of a function definition to a symbol variant. Used when generating a page in order to create a fixed symbol graphic.,Settings,Monolingual text,Not defined,No,No,FORM_RELATION_FUNC_DEF_GRAPHIC
13026,Assignment: Property / value to graphic,Form,Assignment of a property and / or a value to a symbol variant. This property contains the assignment table assigning a graphic to the property and / or the value. A max. of 10 assignments allowed.,Settings,Monolingual text,Not defined,"Yes, 10",No,FORM_BEHAVIOUR_PROPERTY_VAL_GRAPHIC
13027,Jumper display,Form,Graphical display of jumpers: 0 = Line or 1 = Angle.,Settings,Integer,Not defined,No,No,FORM_JUMPER_BEHAVIOUR_LINE_ANGLE
13028,Jumpers: Line thickness,Form,Line thickness used for displaying jumpers.,Settings,Coordinates (only X or Y),Not defined,No,No,FORM_JUMPER_LINE_WIDTH
13029,Jumpers: Number of levels,Form,Number of all jumper levels.,Settings,Integer,Not defined,No,No,FORM_JUMPER_COUNT_LAYERS
13030,Cable chart: No. of cables A,Form,Maximum number of columns or rows (dependent on the form orientation) that can be displayed in the cable chart (for terminal connection points with the form position A).,Settings,Integer,Not defined,No,No,FORM_CABLE_COUNT_A
13031,Cable chart: Spacing for data area A,Form,Distance to be displayed for the data area of the cable chart (for terminal connection points with the form position A).,Settings,Coordinates (only X or Y),Not defined,No,No,FORM_CABLE_DISTANCE_A
13032,Cable chart: No. of cables B,Form,Maximum number of columns or rows (dependent on the form orientation) that can be displayed in the cable chart (for terminal connection points with the form position B).,Settings,Integer,Not defined,No,No,FORM_CABLE_COUNT_B
13033,Cable chart: Spacing for data area B,Form,Distance to be displayed for the data area of the cable chart (for terminal connection points with the form position B).,Settings,Coordinates (only X or Y),Not defined,No,No,FORM_CABLE_DISTANCE_B
13034,Cable chart: No. of cables C,Form,Maximum number of columns or rows (dependent on the form orientation) that can be displayed in the cable chart (for terminal connection points with the form position C).,Settings,Integer,Not defined,No,No,FORM_CABLE_COUNT_C
13035,Cable chart: Spacing for data area C,Form,Distance to be displayed for the data area of the cable chart (for terminal connection points with the form position C).,Settings,Coordinates (only X or Y),Not defined,No,No,FORM_CABLE_DISTANCE_C
13036,Cable chart: No. of cables D,Form,Maximum number of columns or rows (dependent on the form orientation) that can be displayed in the cable chart (for terminal connection points with the form position D).,Settings,Integer,Not defined,No,No,FORM_CABLE_COUNT_D
13037,Cable chart: Spacing for data area D,Form,Distance to be displayed for the data area of the cable chart (for terminal connection points with the form position D).,Settings,Coordinates (only X or Y),Not defined,No,No,FORM_CABLE_DISTANCE_D
13038,Cable chart: No. of cables (internal),Form,Maximum number of columns or rows (dependent on the form orientation) that can be displayed in the cable chart (for internal terminal connection points).,Settings,Integer,Not defined,No,No,FORM_CABLE_COUNT_INT
13039,"Cable chart: Spacing for data area, internal",Form,Distance to be displayed for the data area of the cable chart (for internal terminal connection points).,Settings,Coordinates (only X or Y),Not defined,No,No,FORM_CABLE_DISTANCE_INT
13040,Cable chart: No. of cables (external),Form,Maximum number of columns or rows (dependent on the form orientation) that can be displayed in the cable chart (for external terminal connection points).,Settings,Integer,Not defined,No,No,FORM_CABLE_COUNT_EXT
13041,"Cable chart: Spacing for data area, external",Form,Distance to be displayed for the data area of the cable chart (for external terminal connection points).,Settings,Coordinates (only X or Y),Not defined,No,No,FORM_CABLE_DISTANCE_EXT
13042,Horizontal symbol distance,Form,Distance to be displayed between neighboring symbols.,Settings,Coordinates (only X or Y),Not defined,No,No,FORM_SYMBOL_ABREAST_DISTANCE
13043,Number of adjacent symbols,Form,Number of neighboring symbols to be displayed.,Settings,Integer,Not defined,No,No,FORM_SYMBOL_ABREAST_COUNT
13052,Combine multi-level terminals,Form,Specifies whether multi-level terminals are displayed next to each other or under each other; useful for terminal line-up diagrams.,Settings,Boolean (True / False),Not defined,No,No,FORM_COMBINE_MULTI_LEVEL_TERMINAL
13053,Structure identifier overview,Form,Selection of structure identifiers to be displayed in the form:,Settings,Integer,Not defined,No,No,FORM_STRUCTIDENTIFIEROVERVIEW_TYPE
13054,Summarize external and internal targets in internal targets,Form,"If this property is activated in a form for a device connection diagram, then external and internal targets are output together as internal targets.",Settings,Boolean (True / False),Not defined,No,No,FORM_ALL_TARGETS_AS_INTERN
13055,Use 'Plot frame to edit form' property for reports,Form,"Specifies whether the ""Use 'Plot frame to edit form' property for reports"" property is used or not.",Settings,Boolean (True / False),Not defined,No,No,FORM_FRAME_USEINREPORTS
13056,Form for subsequent pages,Form,"Shows the form for the following page, which can also have its own plot frame. The form for the following page is used with its plot frame as of the second page of a reporting block. If another next page form has been entered for the next page form, this is not taken into account when generating reports.",Settings,Monolingual text,Not defined,No,No,FORM_NEXTPAGEFORM
13059,Separator for multiple values,Form,"If several values are output in a text, then the character entered here is used as a separator. (A character string or a line break can also be entered as a separator.) If the property remains empty then a semicolon is used as a separator. Example: A1;A3;A6.",Settings,Monolingual text,Not defined,No,No,FORM_MULTIRESULT_SEPARATOR
13060,Generate data headers for the first x sorting properties,Form,This property specifies whether and which sorting properties are to be used when generating a new data header area:,Settings,Integer,Not defined,No,No,FORM_RECREATE_MAINTITLE_WITH_SORTPROPS
13064,Manufacturer / supplier list,Form,Monitors the report action of the manufacturer/supplier list:,Settings,Integer,Not defined,No,No,FORM_MANUFACTURERLIST_TYPE
13067,Cable chart: Spacing for header A,Form,Distance to be displayed for the header of the cable chart (for terminal connections with the form position A).,Settings,Coordinates (only X or Y),Not defined,No,No,FORM_CABLETABLE_HEAD_DISTANCE_A
13068,Cable chart: Spacing for header B,Form,Distance to be displayed for the header of the cable chart (for terminal connections with the form position B).,Settings,Coordinates (only X or Y),Not defined,No,No,FORM_CABLETABLE_HEAD_DISTANCE_B
13069,Cable chart: Spacing for header C,Form,Distance to be displayed for the header of the cable chart (for terminal connections with the form position C).,Settings,Coordinates (only X or Y),Not defined,No,No,FORM_CABLETABLE_HEAD_DISTANCE_C
13070,Cable chart: Spacing for header D,Form,Distance to be displayed for the header of the cable chart (for terminal connections with the form position D).,Settings,Coordinates (only X or Y),Not defined,No,No,FORM_CABLETABLE_HEAD_DISTANCE_D
13071,"Cable chart: Spacing for header, internal",Form,Distance to be displayed for the header of the cable chart (for internal terminal connections).,Settings,Coordinates (only X or Y),Not defined,No,No,FORM_CABLETABLE_HEAD_DISTANCE_INT
13072,"Cable chart: Spacing for header, external",Form,Distance to be displayed for the header of the cable chart (for external terminal connections).,Settings,Coordinates (only X or Y),Not defined,No,No,FORM_CABLETABLE_HEAD_DISTANCE_EXT
13076,Cable chart: Header perpendicular to data area,Form,"If this property is activated, the header of the cable chart is displayed across the data area. If it is not activated, the header has the same setup as the data area.",Settings,Boolean (True / False),Not defined,No,No,FORM_CABLETABLEHEAD_ATHWART_TO_CABLETABLEDATA
13077,"Connection diagram: Number of steps, internal",Form,"For connection point diagrams with variable levels, this specifies how many levels are planned for displaying internal targets.",Settings,Integer,Not defined,No,No,FORM_CONNECTIONDIAGRAM_INT_STEPCOUNT
13078,"Connection diagram: Interval between steps, internal",Form,"For connection point diagrams with variable levels, this specifies the spacing between two levels when displaying internal targets. All levels are displayed with the same spacing.",Settings,Coordinates (only X or Y),Not defined,No,No,FORM_CONNECTIONDIAGRAM_INT_STEPOFFSET
13079,"Connection diagram: Number of steps, external",Form,"For connection point diagrams with variable levels, this specifies how many levels are planned for displaying external targets.",Settings,Integer,Not defined,No,No,FORM_CONNECTIONDIAGRAM_EXT_STEPCOUNT
13080,"Connection diagram: Interval between steps, external",Form,"For connection point diagrams with variable levels, this specifies the spacing between two levels when displaying external targets. All levels are displayed with the same spacing.",Settings,Coordinates (only X or Y),Not defined,No,No,FORM_CONNECTIONDIAGRAM_EXT_STEPOFFSET
13081,Suppress data lines,Form,There can be blank data rows in reports when the output properties are blank. Blank data lines are not output if this property is selected.,Settings,Boolean (True / False),Not defined,No,No,FORM_SUPPRESS_EMPTY_LINES
13082,Separator for combined values,Form,"When several values with numbers are entered at the end of a text, the character (or character sequence) entered here is used as a separator. If the property remains blank, the character sequence ""..."" is used as a separator. Example: A1...A5 or A1-A5.",Settings,Monolingual text,Not defined,No,No,FORM_SUMUP_SEPARATOR
13083,Reuse header for new column,Form,"The header is repeated by default for every device when reporting dynamic forms. If this property is activated, the header is also repeated in each new column of the report.",Settings,Boolean (True / False),Not defined,No,No,FORM_HEADER_IN_EACH_COLUMN
13084,Connection diagram: Display all targets,Form,"If this property is activated, all targets will be output up to the first level in the connection diagram. For all other levels, only the first targets are output. In the connection diagram, the targets are placed in a row and are only entered when the connection points belong to the same device and are next to each other in the graphic. In case of several targets, the connection graphic is represented as an oblique line.",Settings,Boolean (True / False),Not defined,No,No,FORM_CONNECTIONDIAGRAM_ALLDESTINATIONS
13085,Connection diagram: Output only connected connection points at targets,Form,"This property stands for device, terminal, cable as well as pin-connection diagrams. If it is activated, only the connected connection points of the displayed targets are output. This helps to save space in the connection diagrams. This property only relates to targets and does not affect the devices, cables, terminal strips, or plugs to be evaluated. These functions are also listed in the connection diagrams. Only the connected function connection points are output at the terminal strip, e.g. in a terminal connection diagram for a motor which is the target of a terminal strip.",Settings,Boolean (True / False),Not defined,No,No,FORM_CONNECTIONDIAGRAM_ONLYCONNECTEDCP
13086,Connection diagram: Internal targets in table form,Form,"If this form property is enabled, the properties of the internal targets are displayed in table format (and not grouped) in connection diagrams. A separate row is displayed for every target. If the internal and external targets are displayed in table format, the column width of the form is not shrunk to the report page.",Settings,Boolean (True / False),Not defined,No,No,FORM_CONNECTIONDIAGRAM_TABULAR_INT
13087,Connection diagram: External targets in table form,Form,"If this form property is enabled, the properties of the external targets are displayed in table format (and not grouped) in connection diagrams. A separate row is displayed for every target. If the internal and external targets are displayed in table format, the column width of the form is not shrunk to the report page.",Settings,Boolean (True / False),Not defined,No,No,FORM_CONNECTIONDIAGRAM_TABULAR_EXT
13088,Revision output with deleted pages,Form,"If this form property is enabled, deleted pages are output in the revision overview. The option ""Pages"" must also be selected for the ""Revision output type"" property (ID 13106). Deleted pages are not output when the property is not enabled.",Settings,Boolean (True / False),Not defined,No,No,FORM_REVISIONOVERVIEW_TYPE_DELETEDPAGES
13090,Connection diagram: Do not divide targets,Form,"If this property is activated, targets in connection point diagrams are always represented completely on a report page, rather than distributed on several report pages. Terminal strips and plugs are always separated regardless of this setting, if necessary, and the separation is drawn with a dotted line.",Settings,Boolean (True / False),Not defined,No,No,FORM_CONNECTIONDIAGRAM_NOBREAKBLOCKSONPAGE
13096,Jumpers: Suppress graphic for saddle jumper option,Form,,Settings,Boolean (True / False),Not defined,No,No,FORM_SUPPRESS_SADDLE_JUMPER_POSSIBILITY
13102,Adapt row height dynamically,Form,"Adjusts the row height in dynamic forms. If a cell contains longer text that causes a line break, then only this row automatically becomes higher.",Settings,Boolean (True / False),Not defined,No,No,FORM_ADAPT_LINEHEIGHT
13103,Use new column for each device,Form,"In dynamically summarized reports, a new device (e.g. terminal strip or plug) begins in a new column.",Settings,Boolean (True / False),Not defined,No,No,FORM_NEWDEVICE_IN_NEWCOLUMN
13104,Display alignable accessories,Form,Enables/disables the display of accessories that can be aligned in reports.,Settings,Boolean (True / False),Not defined,No,No,FORM_VIEW_ACCESSORIES
13105,No line feed in data header area,Form,Controls the position of the data header area in forms. If the property is activated then the data header area is output with the next data row. If the property is deactivated then the data header area is output in its own row.,Settings,Boolean (True / False),Not defined,No,No,FORM_CAPTION_IN_DATALINE
13106,Revision output type,Form,This form property shows which revision data are output in the revision overview:,Settings,Boolean (True / False),Not defined,No,No,FORM_REVISIONOVERVIEW_TYPE
13108,Replace variable values with text,Form,"This property is only available in summarized parts lists. If it is activated, then a text - not a value - from the project settings will be output for the corresponding property in functions that have a variable defined in the placeholder object.",Settings,Boolean (True / False),Not defined,No,No,FORM_REPLACE_VAR_VALUES
13109,Symbol variant,Form,"Specifies which symbol variant is displayed for output in the form for symbols that are represented by the ""Symbol graphic"" property.",Settings,Integer,Not defined,No,No,FORM_SYMBOL_VARIANT
13110,Reuse data header area for new column,Form,"The data header area is repeated by default for every function for reporting dynamic forms. If this property is enabled, the data header area is also repeated in every new column of the report.",Settings,Boolean (True / False),Not defined,No,No,FORM_CAPTION_IN_EACH_COLUMN
13111,Combine in a line by,Form,"You specify the form properties for which identical data are to be entered in a row. For instance, you can combine the data for each page type in the table of contents. A semi-colon and the character sequence ""..."" are used as separators by default for entered values. However, you can also specify other separators via the properties ""Separator for multiple values"" and ""Separator for combined values"".",Settings,Monolingual text,Not defined,No,No,FORM_SUMMARIZE_PROPERTIES
13112,Align graphics to insertion point (without alignment box),Form,The property can be used in forms and does affect all placeholders for graphics for which the alignment box has not been activated. The handle is set at the insertion point of the placeholder text for the symbols and macros inserted via this type of placeholder.,Settings,Boolean (True / False),Not defined,No,No,FORM_USE_PHT_INSERTIONPOINT
13113,Connection point-specific output,Form,"If this property is activated, a row is generated in terminal diagrams and terminal connection diagrams for each pair of connection points. Terminals with more than two connection points are automatically split across multiple rows. In addition, terminal connection points that are not connected are output. In addition, jumpers between an internal and an external connection point are not evaluated and displayed as jumpers.",Settings,Boolean (True / False),Not defined,No,No,FORM_TERMCON_ORIENTED
13114,Output only used symbols,Form,"If this property is activated, only the symbols actually used in the project will be output in the symbol overview. If the property is deactivated, all symbols of the symbol libraries stored in the project will be output.",Settings,Boolean (True / False),Not defined,No,No,FORM_USED_SYMBOLS_ONLY
13115,Alphanumeric sorting for internal connection points,Form,"This form property is intended for use in table device connection diagrams in order to output the connection points there in an alphanumeric, collated, manner. For all connection points to be output internally and collated jointly, you must also activate the ""Summarize external and internal targets in internal targets"" (ID 13054) property. You cannot collate only external connection points.",Settings,Boolean (True / False),Not defined,No,No,FORM_SORT_INTERNAL_CP
13117,Connection diagram: Target tracking across all devices,Form,"If this property is activated, the target tracking in connection point diagrams will be continued via any devices. For the search for further targets, the Target tracking (PLC) to property is used in the connection point logic of the devices. In addition, the Connection point diagram: Output only connected connection points (ID 13085) property is evaluated as activated.",Settings,Boolean (True / False),Not defined,No,No,FORM_CONNECTIONDIAGRAM_TARGET_TRACKING_ALL
13118,Apply abbreviation rules to all structure properties,Form,,Settings,Boolean (True / False),Not defined,No,No,FORM_REDUCE_STRUCTUREPROPS
13119,Output all subordinate segments,Form,"When this form property is activated, all the subordinate segments are also determined and output for each segment in the data area of a report of the type ""Structure segment plan"" or ""Planning object plan"".",Settings,Boolean (True / False),Not defined,No,No,FORM_SUBOBJECTS_RECURSIVE
13120,Suppress property placements,Form,"This property is only available for forms of the ""Symbol overview"" type. If the property is activated, only the symbol graphics are output in the symbol overview, but not the properties displayed by default at the symbol.",Settings,Boolean (True / False),Not defined,No,No,FORM_SUPRESS_PROPERTYINSTANCES
13121,Connection diagram: Output only connected connection points,Form,"This property is only available for device connection diagrams. if it is activated, only the connected connection points of the reported device are displayed.",Settings,Boolean (True / False),Not defined,No,No,FORM_MAINEVALUATIONOBJECT_ONLYCONNECTEDCP
