ID,Designation,Object classes,Description,Category,Field type,Unit group,Index,R/O,API define
1129,Function designation (visible),Function (base object),Shows the component of the respective identifier block of the displayed DT. Blanks or line breaks that are available in the displayed DT are not displayed for this property.,Devices,Monolingual text,Not defined,No,Yes,DESIGNATION_PLANT_VISIBLE
1130,Function designation (main identifier): Description,Function (base object),,Devices,Multilingual text,Not defined,No,Yes,DESIGNATION_PLANT_DESCR
1229,Location designation (visible),Function (base object),Shows the component of the respective identifier block of the displayed DT. Blanks or line breaks that are available in the displayed DT are not displayed for this property.,Devices,Monolingual text,Not defined,No,Yes,DESIGNATION_LOCATION_VISIBLE
1329,Functional assignment (visible),Function (base object),Shows the component of the respective identifier block of the displayed DT. Blanks or line breaks that are available in the displayed DT are not displayed for this property.,Devices,Monolingual text,Not defined,No,Yes,DESIGNATION_FUNCTIONALASSIGNMENT_VISIBLE
1421,"Installation site (sub-identifier, complete)",Function (base object),Provides the full name of the installation site with all the sub-identifiers.,Devices,Monolingual text,Not defined,No,Yes,DESIGNATION_FULLSUBPLACEOFINSTALLATION
1429,Installation site (visible),Function (base object),Shows the component of the respective identifier block of the displayed DT. Blanks or line breaks that are available in the displayed DT are not displayed for this property.,Devices,Monolingual text,Not defined,No,Yes,DESIGNATION_PLACEOFINSTALLATION_VISIBLE
1600,User-defined structure (main identifier),Function (base object),Provides the main identifier of the user-defined structure.,Devices,Monolingual text,Not defined,No,Yes,DESIGNATION_USERDEFINED
1620,User-defined structure,Function (base object),Provides the full character string of the user-defined structure.,Devices,Monolingual text,Not defined,No,Yes,DESIGNATION_FULLUSERDEFINED
1621,"User-defined structure (sub-identifier, complete)",Function (base object),Provides the full name of the user-defined structure with all the sub-identifiers.,Devices,Monolingual text,Not defined,No,Yes,DESIGNATION_FULLSUBUSERDEFINED
1629,User-defined structure (visible),Function (base object),Shows the component of the respective identifier block of the displayed DT. Blanks or line breaks that are available in the displayed DT are not displayed for this property.,Devices,Monolingual text,Not defined,No,Yes,DESIGNATION_USERDEFINED_VISIBLE
1700,Higher-level function number (main identifier),Function (base object),The first (and in this case only) hierarchy level of the higher-level function number. Is required for fluid power.,Devices,Monolingual text,Not defined,No,Yes,DESIGNATION_INSTALLATIONNUMBER
1729,Higher-level function number (visible),Function (base object),Shows the component of the respective identifier block of the displayed DT. Blanks or line breaks that are available in the displayed DT are not displayed for this property.,Devices,Monolingual text,Not defined,No,Yes,DESIGNATION_INSTALLATIONNUMBER_VISIBLE
1829,Product (visible),Function (base object),"Shows the ""Product aspect"" component of the visible DT. A value is only displayed here if the extended reference identification is activated in the project structure and the product aspect is used for structuring. Blanks or line breaks that are available in the displayed DT are not displayed for this property.",Devices,Monolingual text,Not defined,No,Yes,DESIGNATION_PRODUCT_VISIBLE
1830,Product (main identifier): Description,Function (base object),,Devices,Multilingual text,Not defined,No,Yes,DESIGNATION_PRODUCT_DESCR
20000,Name (identifying),Function (base object),"Identifying name of the function, consisting of the identifying device tag, the connection point designation for connection points, and the terminal designation for terminals.",Devices,Monolingual text,Not defined,No,Yes,FUNC_IDENTNAME
20001,Name (full),Function (base object),"Full name, such as the identifying name, but also still contains additional describing identifier elements.",Devices,Monolingual text,Not defined,No,Yes,FUNC_FULLNAME
20002,Name (visible),Function (base object),"Displayed name, contains the name as it was entered for the displayed DT in the properties dialog. May also contain terminal designation, etc.",Devices,Monolingual text,Not defined,No,Yes,FUNC_VISIBLENAME
20003,"DT (superior, without project structures)",Function (base object),Supplies the superior device tag without project structures.,Devices,Monolingual text,Not defined,No,Yes,FUNC_DEVICETAG_MAIN
20004,"DT (subordinate, without project structures)",Function (base object),Supplies the subordinate device tag without project structures.,Devices,Monolingual text,Not defined,No,Yes,FUNC_DEVICETAG_NESTED
20005,DT (identifying),Function (base object),Contains the identifying device tag of the function (without terminal / connection point designation).,Devices,Monolingual text,Not defined,No,Yes,FUNC_IDENTDEVICETAG
20006,DT (full),Function (base object),Contains the full device tag of the function (without terminal / connection point designation).,Devices,Monolingual text,Not defined,No,Yes,FUNC_FULLDEVICETAG
20010,DT (displayed),Function (base object),The part of the device tag that is displayed in the graphical editor.,Devices,Monolingual text,Not defined,No,Yes,FUNC_VISIBLEDEVICETAG
20012,DT: Prefix,Function (base object),"Specifies the prefix before an identifier letter. Any prefix can be chosen, but a number is most practical. For example, you receive a DT ""4K5"" with the digit ""4"" as the prefix. You also obtain this type of DT when you display the page number in the DT; in this case the DT changes when you change the page number. If you use a fixed prefix instead, then the DT does not change.",Devices,Monolingual text,Not defined,No,Yes,FUNC_PREFIX
20013,DT: Identifier,Function (base object),"By default, the identifier letter assigned to the function definition is adopted, but this can be overwritten.",Devices,Monolingual text,Not defined,No,Yes,FUNC_CODE
20014,DT: Counter,Function (base object),Counter for assigning DTs.,Devices,Monolingual text,Not defined,No,Yes,FUNC_COUNTER
20015,DT: Subcounter,Function (base object),Suffix for the DT.,Devices,Monolingual text,Not defined,No,Yes,FUNC_SUFFIX
20016,DT (subordinate): Prefix,Function (base object),"Shows the prefix before an identifier in the subordinate DT. Any prefix can be chosen, but a number is most practical. For example, you receive a DT ""4K5"" with the digit ""4"" as the prefix. You also obtain this type of DT when you display the page number in the DT; in this case the DT changes when you change the page number. If you use a fixed prefix instead, then the DT does not change.",Devices,Monolingual text,Not defined,No,Yes,FUNC_NESTEDPREFIX
20017,DT (subordinate): Identifier,Function (base object),"Identifier in the subordinate DT. By default, the identifier letter assigned to the function definition is adopted, but this can be overwritten.",Devices,Monolingual text,Not defined,No,Yes,FUNC_NESTEDCODE
20018,DT (subordinate):Counter,Function (base object),Counter in the subordinate DT.,Devices,Monolingual text,Not defined,No,Yes,FUNC_NESTEDCOUNTER
20019,DT (subordinate): Subcounter,Function (base object),Suffix for the subordinate DT.,Devices,Monolingual text,Not defined,No,Yes,FUNC_NESTEDSUFFIX
20020,DT (project structures only),Function (base object),"Provides only the project structures, e.g. ""=A1+O1"".",Devices,Monolingual text,Not defined,No,Yes,FUNC_DEVICETAG_ONLYSTRUCTURES
20211,"DT (superior, without project structures, with preceding sign)",Function (base object),"Provides the superior device tag without the project structures, but with information about the preceding sign.",Devices,Monolingual text,Not defined,No,Yes,FUNC_DEVICETAG_MAIN_WITHSEPARATOR
20212,"DT (subordinate, without project structures, with preceding sign)",Function (base object),"Provides the subordinate device tag without the project structures, but with information about the preceding sign.",Devices,Monolingual text,Not defined,No,Yes,FUNC_DEVICETAG_NESTED_WITHSEPARATOR
20316,Media code,Function (base object),"This property is used to map the designations used in the standard DIN ISO 1219-2 for fluid power in Eplan. For fluid power devices the identifier of the device is displayed here, meaning the contents of the property DT: Identifier (ID 20013). If the project setting Fluid power: Use trade identifier as identifier (media code) is activated, the trade identifier is displayed.",Devices,Monolingual text,Not defined,No,Yes,FUNC_CRAFTCODE
20317,Circuit number,Function (base object),"This property is used to map the designations used in the standard DIN ISO 1219-2 for fluid power in Eplan. For fluid power devices the counter of the device is displayed here, meaning the contents of the property DT: Counter (ID 20014).",Devices,Monolingual text,Not defined,No,Yes,FUNC_CIRCUITNUMBER
20318,Item number,Function (base object),"This property is used to map the designations used in the standard DIN ISO 1219-2 for fluid power in Eplan. For fluid power devices the subcounter of the device is displayed here, meaning the contents of the property DT: Subcounter (ID 20015).",Devices,Monolingual text,Not defined,No,Yes,FUNC_COMPONENTNUMBER
